產品包裝,名稱,下片日期,目錄路徑,簡介,演員,授權,連結,圖片,更新日期
紀實149,冰凍星球-夏季,2017-11-02,紀實149/自然生態 ,【冰凍星球-夏季】《冰凍星球》（英語：Frozen Planet）為英國廣播公司與探索頻道及英國公開大學聯合製作的自然紀錄片，由大衛‧愛登堡旁白，2011年10月26日起於英國廣播公司第一台及高清頻道首播，共6集，主要展示棲息於北極和南極的動植物及其生境，本集內容為其系列作第三集夏季。,,,http://mod.cht.com.tw/video/movie-details.php?id=447998,http://mod.cht.com.tw/img/iappic/447998.jpg,2017-10-06 21:58:03
紀實149,天堂百貨第一季4,2017-12-14,紀實149/人物傳記 ,【天堂百貨第一季4】以維多利亞時代英國第一家百貨商店為背景，《天堂百貨公司》講述了一個平民階級的女孩迷上了摩登世界後的蛻變。丹妮絲深知自己是個卑微的售貨小姐，所以她必須爭取權利、投入心機甚至是來上一點風流韻事以建立生存之路。當自己的天賦被執著而有魄力的老闆約翰莫瑞發現之後，丹妮絲發現自己有了借此上位的機會。通過一個個香豔而曲折的充滿浪漫與誘惑的故事，本劇營造出一個猶如商店貨架上的絲綢一樣繽紛迷人的世界。這是一個愛情故事，也是一個關於追求和上進的故事，但卻伴隨著那不為人知的黑暗秘密，本集為其系列作第4集。,,多螢,http://mod.cht.com.tw/video/movie-details.php?id=456969,http://mod.cht.com.tw/img/iappic/456969.jpg,2017-10-06 21:58:03
紀實149,星光好萊塢：麥克邁爾斯,2017-11-16,紀實149/人物傳記 ,【星光好萊塢】介紹了好萊塢最耀眼的巨星們私下的生活與事業。節目採訪、紅毯致詞、電影幕後隱藏花絮、首映致詞，涵蓋巨星尚未成名前的青澀樣貌到躍上頒獎台最動人的演說，【星光好萊塢】帶您一窺明星們的人生旅途。從安潔莉娜裘莉、強尼戴普、梅莉史翠普，到湯姆漢克、馬修麥康納、史嘉蕾韓森，迷人巨星風采無一遺漏。,,多螢,http://mod.cht.com.tw/video/movie-details.php?id=454433,http://mod.cht.com.tw/img/iappic/454433.jpg,2017-10-06 21:58:03
紀實149,探索三部曲-愛的角動量(上),2017-11-16,紀實149/科學探索 ,愛情和物理究竟有什麼關係？什麼力量讓生命中兩個人相伴相隨？什麼力量維持這樣旋轉又美麗的世界？從生活探索至宇宙，結合劇情與科學，欣賞戲劇張力時，可同時體驗到科學的趣味,"張郁婕,戴安齊",多螢,http://mod.cht.com.tw/video/movie-details.php?id=451967,http://mod.cht.com.tw/img/iappic/451967.jpg,2017-10-06 21:58:03
紀實149,地球最後的遺產-剛果-剛果河的史詩,2017-10-26,紀實149/風土人文 ,百川之國：四千七百公尺長的剛果河是世界上最深的河流，兇險的急流阻斷了許多探險家的去路。但瓦吉尼亞人卻以剛果河為生，他們自稱烏龜的後代，以獨特的捕魚方式世世代代沿著急流而居住。被稱作「水之王國」的班維烏魯溼地有著迷人的景色，大型的鳥類、輕巧的驢羚，還有溼地的王者河馬一起在此生存。這片因水而產生的巨大王國，因為大自然與生物，交織出一片壯觀的景色。,,多螢,http://mod.cht.com.tw/video/movie-details.php?id=457365,http://mod.cht.com.tw/img/iappic/457365.jpg,2017-10-06 21:58:03
紀實149,麵條之路4,2017-10-26,紀實149/風土人文 ,在曼谷白菜園宮殿的最南端，有一間四面被金光燦爛的壁畫圍繞著的密室。這些十七世紀的壁畫，正描述著佛祖的一生。人們經常會拿自己最珍貴的食物，來供奉神明。而在另一處，有人正在準備其他供奉的食物。從袋子裡流出來細長模樣的食物，放進滾燙的熱水中，那就是麵條。對泰國人而言，麵條是供奉神明的貴重食物。,,多螢,http://mod.cht.com.tw/video/movie-details.php?id=458984,http://mod.cht.com.tw/img/iappic/458984.jpg,2017-10-06 21:58:03
紀實149,祖孫夏令營(幸福銀髮讚),2017-12-28,紀實149/風土人文 ,祖孫代間問題多，祖孫夏令營幫助增長祖孫情誼。經歷過出血性腦中風的黃政平，決定放慢腳步，調整生活作息，活出自己的健康人生。呂炳男樂於教人甩手功養生健康，興趣卻是騎重機，以養生和興趣豐富他的精采人生。,,多螢,http://mod.cht.com.tw/video/movie-details.php?id=460080,http://mod.cht.com.tw/img/iappic/460080.jpg,2017-10-06 21:58:03
紀實149,寵物萌樂園S1第4集,2017-12-07,紀實149/寵物天地 ,號稱世外桃源的夏威夷，除了擁有豐富的自然美景以外，也充滿了人與動物互動的感人故事。《寵物萌樂園》中動物被人類的愛提升到一個高境界，並以更高貴的情操回饋人類。細膩寫實的手法，捕捉了人與動物之間的感情與互助。,,多螢,http://mod.cht.com.tw/video/movie-details.php?id=456059,http://mod.cht.com.tw/img/iappic/456059.jpg,2017-10-06 21:58:03
紀實149,星光好萊塢：金凱瑞,2017-10-19,紀實149/人物傳記 ,【星光好萊塢】介紹了好萊塢最耀眼的巨星們私下的生活與事業。節目採訪、紅毯致詞、電影幕後隱藏花絮、首映致詞，涵蓋巨星尚未成名前的青澀樣貌到躍上頒獎台最動人的演說，【星光好萊塢】帶您一窺明星們的人生旅途。從安潔莉娜裘莉、強尼戴普、梅莉史翠普，到湯姆漢克、馬修麥康納、史嘉蕾韓森，迷人巨星風采無一遺漏。,,,http://mod.cht.com.tw/video/movie-details.php?id=446749,http://mod.cht.com.tw/img/iappic/446749.jpg,2017-10-06 21:58:03
紀實149,生命密碼-癌症戰爭,2017-11-09,紀實149/知性新知 ,在許多人心目中，癌症依然是與絕症劃上等號，確實是人類一個很大的健康的問題。,趙情晴,多螢,http://mod.cht.com.tw/video/movie-details.php?id=450523,http://mod.cht.com.tw/img/iappic/450523.jpg,2017-10-06 21:58:03
紀實149,星光好萊塢：威爾史密斯,2017-10-12,紀實149/人物傳記 ,【星光好萊塢】介紹了好萊塢最耀眼的巨星們私下的生活與事業。節目採訪、紅毯致詞、電影幕後隱藏花絮、首映致詞，涵蓋巨星尚未成名前的青澀樣貌到躍上頒獎台最動人的演說，【星光好萊塢】帶您一窺明星們的人生旅途。從安潔莉娜裘莉、強尼戴普、梅莉史翠普，到湯姆漢克、馬修麥康納、史嘉蕾韓森，迷人巨星風采無一遺漏。,,,http://mod.cht.com.tw/video/movie-details.php?id=445484,http://mod.cht.com.tw/img/iappic/445484.jpg,2017-10-06 21:58:03
紀實149,舞林爭霸第7集,2017-10-19,紀實149/音樂藝術 ,舞蹈真人秀節目。為專業舞者提供展示平臺，舞蹈種類涵蓋現代舞、嘻哈舞、國標舞分拉丁舞和摩登舞等舞蹈領域，為國內舞蹈愛好者提供了一個競爭、展示、交流平臺。,"金星,方俊,楊麗萍,陳小春",多螢,http://mod.cht.com.tw/video/movie-details.php?id=450538,http://mod.cht.com.tw/img/iappic/450538.jpg,2017-10-06 21:58:03
紀實149,一次世界大戰生存者訪談實錄,2017-12-21,紀實149/軍事戰爭 ,【一次世界大戰生存者訪談實錄】帝國戰爭博物館存放著一件特別的珍寶。這件珍寶是與第一次世界大戰有關的目擊者證詞。《偉大戰爭》拍攝於50年前，是BBC紀錄片的代表作，但BBC只播放了這部影片的很小一部分。《我是親歷者：一戰訪談錄》精心挑選軍人和平民的訪談記錄，首次公佈他們的訪談內容。這部深刻的影片生動真實，震撼人心：從炮火轟炸的恐怖到被迫殺人的年輕人的痛苦，從戰場上短暫的平靜到失去至親的婦女的悲傷故事。這是一戰期間的真實生活，目擊者依然對當時的情景歷歷在目，他們仍然感到警醒和憤慨。最後，他們將有機會跨越時空與,,多螢,http://mod.cht.com.tw/video/movie-details.php?id=457354,http://mod.cht.com.tw/img/iappic/457354.jpg,2017-10-06 21:58:03
紀實149,寵物狗救星第7集,2017-12-07,紀實149/寵物天地 ,一個比熊犬家族遇上西摩犬，一團團白色的可愛生物，但原來一直爭風吃醋，令主人非常困擾。人類會有情緒病，狗狗也有，而「分離焦慮症」就是最多狗狗會患上的心理病症，究竟主人要如何處理？又能否根治呢？,,多螢,http://mod.cht.com.tw/video/movie-details.php?id=456061,http://mod.cht.com.tw/img/iappic/456061.jpg,2017-10-06 21:58:03
紀實149,天堂百貨第二季4,2017-12-28,紀實149/人物傳記 ,【天堂百貨第二季4】天堂百貨公司，在英國第一大百貨商場令人迷醉的輝煌中，重啟了第二季的大門。隨著聰明伶俐、志向遠大又慷慨仗義的丹妮絲洛維特，這一季的故事開始於莫瑞向丹妮絲表白並失去天堂百貨公司這些戲劇性事件發生的一年之後。在莫瑞打破兩人的婚約後，被拋棄的凱薩琳嫁給了一位經歷複雜、神秘且令人敬畏的前軍官-湯姆韋斯頓。儘管她想開始新的生活，但是對莫瑞強烈的感情恐怕會將她拖入莫瑞及丹妮絲的三角戀之中。同時，莫瑞和丹妮絲，仍站在時尚與創新前端的兩個人，計畫不計代價的要將天堂百貨從凱薩琳和她丈夫手裡收回來。 充滿了,,多螢,http://mod.cht.com.tw/video/movie-details.php?id=459023,http://mod.cht.com.tw/img/iappic/459023.jpg,2017-10-06 21:58:03
紀實149,音樂人生,2017-11-30,紀實149/音樂藝術 ,橫掃亞洲多項紀錄片大獎！一個從小就被讚譽為天才的音樂神童，在成長的過程中，不斷拉扯著自己，追尋自我與夢想的故事。,,多螢,http://mod.cht.com.tw/video/movie-details.php?id=455087,http://mod.cht.com.tw/img/iappic/455087.jpg,2017-10-06 21:58:03
紀實149,星光好萊塢：寇特羅素,2017-11-02,紀實149/人物傳記 ,【星光好萊塢】介紹了好萊塢最耀眼的巨星們私下的生活與事業。節目採訪、紅毯致詞、電影幕後隱藏花絮、首映致詞，涵蓋巨星尚未成名前的青澀樣貌到躍上頒獎台最動人的演說，【星光好萊塢】帶您一窺明星們的人生旅途。從安潔莉娜裘莉、強尼戴普、梅莉史翠普，到湯姆漢克、馬修麥康納、史嘉蕾韓森，迷人巨星風采無一遺漏。,,多螢,http://mod.cht.com.tw/video/movie-details.php?id=450877,http://mod.cht.com.tw/img/iappic/450877.jpg,2017-10-06 21:58:03
紀實149,舞林爭霸第13集(完),2017-12-28,紀實149/音樂藝術 ,舞蹈真人秀節目。為專業舞者提供展示平臺，舞蹈種類涵蓋現代舞、嘻哈舞、國標舞分拉丁舞和摩登舞等舞蹈領域，為國內舞蹈愛好者提供了一個競爭、展示、交流平臺。,"金星,方俊,楊麗萍,陳小春",多螢,http://mod.cht.com.tw/video/movie-details.php?id=460081,http://mod.cht.com.tw/img/iappic/460081.jpg,2017-10-06 21:58:03
紀實149,麵條之路2,2017-10-26,紀實149/風土人文 ,通往絲路的關口甘肅，這是一座一千五百年前的貴族墓穴。在墓穴中的壁畫裡，這個墓穴主人所吃的食物，被描繪得栩栩如生。西域風格的烤羊肉串、青銅鍋裡的湯料理，這些食物，象徵著西方和中國飲食文化的交流。本集要介紹在東西文明交流下，所誕生的一種很特別的食物。一起來解開，呈現在人類廚房中的麵食秘密。,,多螢,http://mod.cht.com.tw/video/movie-details.php?id=458220,http://mod.cht.com.tw/img/iappic/458220.jpg,2017-10-06 21:58:03
紀實149,文化大觀園-中國元素日本製二、天目盞的誘惑,2017-11-16,紀實149/風土人文 ,攝製組來到日本，尋找那些當年由中國發源創造，卻在日本匠人手中生根重塑的技藝，探究那些源自于中國的美是如何在日本代代迭新、璀璨綻放。本集探訪天目盞燒製大師鐮田幸二及從未對外開放過的保密工坊。,王魯湘,多螢,http://mod.cht.com.tw/video/movie-details.php?id=451961,http://mod.cht.com.tw/img/iappic/451961.jpg,2017-10-06 21:58:03
紀實149,雲上的行走2-日光城的夏日生活,2017-11-23,紀實149/風土人文 ,拉薩人就喜歡在大熱天裡往外跑，拉薩的夏天不僅有特別的美食，還有很多精采的平時沒有的活動。那到底，拉薩的夏天有什麼特別的新鮮事呢？本集帶您去看看。,,多螢,http://mod.cht.com.tw/video/movie-details.php?id=454414,http://mod.cht.com.tw/img/iappic/454414.jpg,2017-10-06 21:58:03
紀實149,大貓末日,2017-11-09,紀實149/自然生態 ,五十年前，非洲還有超過五十萬隻的獅子，如今僅剩下約兩萬隻。叢林之王，萬獸莫敵的掠食者如今已逐漸走向衰亡。野生環境的無形摧殘加上人類的利益貪婪，使得這些大型貓科動物，不斷減少致令人憂心的地步。政府開始設立保護區及立法規範來維持生態平衡，讓世界正視保育的重要性。面臨著一場毫勝勝算的生存之戰，獅子、花豹及獵豹該何去何從？未來，真的是屬於大貓的末日盡頭嗎？,,多螢,http://mod.cht.com.tw/video/movie-details.php?id=450888,http://mod.cht.com.tw/img/iappic/450888.jpg,2017-10-06 21:58:03
紀實149,魔術實驗室第7集,2017-12-14,紀實149/科學探索 ,眼前所見的奇怪現象，是神秘的科學？還是神奇的魔術？消失的湯匙到哪裡去了？是魔術師的手法？還是我們不知道的科學原理？運用簡單易懂的小短劇，讓你輕鬆認識科學，兼具教育意義與娛樂效果的綜藝－魔術實驗室！,"全炫茂,金俊賢,李恩傑",多螢,http://mod.cht.com.tw/video/movie-details.php?id=458291,http://mod.cht.com.tw/img/iappic/458291.jpg,2017-10-06 21:58:03
紀實149,魔術實驗室第10集,2018-01-04,紀實149/科學探索 紀實149/本週推薦 ,眼前所見的奇怪現象，是神秘的科學？還是神奇的魔術？消失的湯匙到哪裡去了？是魔術師的手法？還是我們不知道的科學原理？運用簡單易懂的小短劇，讓你輕鬆認識科學，兼具教育意義與娛樂效果的綜藝－魔術實驗室！,"全炫茂,金俊賢,李恩傑",多螢,http://mod.cht.com.tw/video/movie-details.php?id=461007,http://mod.cht.com.tw/img/iappic/461007.jpg,2017-10-06 21:58:03
紀實149,星光好萊塢：史恩康納萊,2017-12-14,紀實149/人物傳記 ,【星光好萊塢】介紹了好萊塢最耀眼的巨星們私下的生活與事業。節目採訪、紅毯致詞、電影幕後隱藏花絮、首映致詞，涵蓋巨星尚未成名前的青澀樣貌到躍上頒獎台最動人的演說，【星光好萊塢】帶您一窺明星們的人生旅途。從安潔莉娜裘莉、強尼戴普、梅莉史翠普，到湯姆漢克、馬修麥康納、史嘉蕾韓森，迷人巨星風采無一遺漏。,,多螢,http://mod.cht.com.tw/video/movie-details.php?id=458250,http://mod.cht.com.tw/img/iappic/458250.jpg,2017-10-06 21:58:03
紀實149,夢想改造家第6集,2017-11-23,紀實149/美食生活 ,節目大膽突破了以色彩和擺飾為主的傳統裝修形式，聚焦在空間改變和功能實現上，由頂尖設計師在有限的資金，有限的空間裡根據委託人的特殊需求進行徹底的改造，通過聚焦全國範圍內不同地域特色的建築物，不同類型和背景的家庭故事，揭示家給予人的意義，見證家裝改造給予人的幸福。,"駱新,施琰",多螢,http://mod.cht.com.tw/video/movie-details.php?id=454441,http://mod.cht.com.tw/img/iappic/454441.jpg,2017-10-06 21:58:03
紀實149,榮耀之盡4,2017-11-23,紀實149/人物傳記 ,【榮耀之盡4】故事敘述貴族克里斯多夫先是愛上了荒淫的希薇亞，但結婚後她繼續荒淫。此時他又愛上了清純的瓦倫泰，面對心儀的女子，他只能將愛意藏在心中…希薇亞一心想去法國前線看望丈夫，卻遭遇各方阻攔，但她仍堅持己見…。,,多螢,http://mod.cht.com.tw/video/movie-details.php?id=451950,http://mod.cht.com.tw/img/iappic/451950.jpg,2017-10-06 21:58:03
紀實149,跑酷少年,2017-11-02,紀實149/人物傳記 ,新疆維族面對青春與成長的故事。達爾高考失利，父親早亡，家庭負擔讓他變得小心翼翼。弟弟希萊力喜歡冒險刺激，夢想成為像成龍那樣的人物。母親為四處遊蕩且成長迅速的兒子擔心，且收入微薄，整日愁眉不展。ESP 跑酷團隊集合了各種民族年紀相仿的孩子，信心滿滿地準備著將在北京舉辦的跑酷大賽！一次次掃興與失望接踵而來，艾達爾動搖了，隊員情緒也出現反覆，勇敢無畏的希萊力和薩達姆則惦記著無論如何這次都要闖蕩北京。,,多螢,http://mod.cht.com.tw/video/movie-details.php?id=449902,http://mod.cht.com.tw/img/iappic/449902.jpg,2017-10-06 21:58:03
紀實149,我是楊麗花第十集,2017-11-23,紀實149/音樂藝術 ,20強選手進入決賽第十場。(拿手絕活自選賽) 總評審長：楊麗花出場選手：羅育忠、王婕菱、何佩芸。20強選手全員到場進行拜師儀式。,,多螢,http://mod.cht.com.tw/video/movie-details.php?id=454437,http://mod.cht.com.tw/img/iappic/454437.jpg,2017-10-06 21:58:03
紀實149,星光好萊塢：亞當山德勒,2017-10-19,紀實149/人物傳記 ,【星光好萊塢】介紹了好萊塢最耀眼的巨星們私下的生活與事業。節目採訪、紅毯致詞、電影幕後隱藏花絮、首映致詞，涵蓋巨星尚未成名前的青澀樣貌到躍上頒獎台最動人的演說，【星光好萊塢】帶您一窺明星們的人生旅途。從安潔莉娜裘莉、強尼戴普、梅莉史翠普，到湯姆漢克、馬修麥康納、史嘉蕾韓森，迷人巨星風采無一遺漏。,,,http://mod.cht.com.tw/video/movie-details.php?id=446747,http://mod.cht.com.tw/img/iappic/446747.jpg,2017-10-06 21:58:03
紀實149,菜鳥獸醫5,2017-11-09,紀實149/寵物天地 ,【菜鳥獸醫5】這部紀錄片由BBC攝製組跟踪拍攝10位準畢業生最後一年臨床實習的特別經歷。他們來自全球聞名的英國皇家獸醫學院（Royal Veterinary College，簡稱RVC）。該學院建立於1791年，隸屬於倫敦大學，是英國最早的，也是規模最大的獸醫學院。（這是多少歐洲獸醫學子的dream land~）和國內大多數獸醫重點大學一樣，Royal Veterinary College 的本科學生也是5年制，最後一年是關鍵的臨床實習期。這一年，獸醫學生們要在不同領域的診所治療貓狗，在動物園拯救野生動物,,多螢,http://mod.cht.com.tw/video/movie-details.php?id=451954,http://mod.cht.com.tw/img/iappic/451954.jpg,2017-10-06 21:58:03
紀實149,野性法國第一季1,2017-10-26,紀實149/自然生態 ,【野性法國第一季1】《野性法國》帶你走進法國美麗而神秘的鄉郊地區，探索當地獨特的野生動物。節目展現法國鄉郊地區形形色色的野生動物，包括準備帶子女展開第一次遷徙旅程的雁鳥家庭、為爭奪領地「反目成仇」的公鹿、仍在學習求生技能的野狼寶寶，以及漫遊山野尋找配偶的野豬。節目又會訪問當地的野生動物保育人士和爬山專家，探討人類與大自然的關係，本集為系列作第一集。,,,http://mod.cht.com.tw/video/movie-details.php?id=446732,http://mod.cht.com.tw/img/iappic/446732.jpg,2017-10-06 21:58:03
紀實149,麵條之路6,2017-10-26,紀實149/風土人文 ,在這世界上，存在著多采多姿的飲食文化，樣式多得宛如不同的種族與民族一樣。而可以完全展現人類創意的華麗競賽舞台，就是麵條的烹調世界。在麵條之路上，我們尋找出的珍貴麵條，到底隱藏著什麼樣的故事呢？,,多螢,http://mod.cht.com.tw/video/movie-details.php?id=459007,http://mod.cht.com.tw/img/iappic/459007.jpg,2017-10-06 21:58:03
紀實149,發現之海南行（一）,2017-10-19,紀實149/風土人文 ,什麼東西讓他們讚不絕口？為什麼有人卻無法接受？它到底有多香？它到底有多臭？一切答案本集揭曉。海天飛龍飛出了蜈支洲島新一代漁民的新生活，而能使之傳播的更久遠的則是，一個民族飲食文化中的傳承。,,,http://mod.cht.com.tw/video/movie-details.php?id=446725,http://mod.cht.com.tw/img/iappic/446725.jpg,2017-10-06 21:58:03
紀實149,記者再報告-朝鮮的太陽,2017-11-09,紀實149/時事追蹤 ,獲準到平壤采訪朝鮮前領導人金日成冥誕105周年太陽節的130名外國記者，4月11號開始集中抵達平壤。,霍偉偉,多螢,http://mod.cht.com.tw/video/movie-details.php?id=450516,http://mod.cht.com.tw/img/iappic/450516.jpg,2017-10-06 21:58:03
紀實149,全球瘋旅遊：第3季-杜拜,2018-01-04,紀實149/風土人文 紀實149/本週推薦 ,杜拜，為阿拉伯聯合大公國中人口最多的城市，位於波斯灣東岸，同時也是中東地區金融和經濟最亮眼的一顆星。近幾十年來，杜拜快速的發展成全球具有指標的大城市，成為了世界貨運和乘客的重要樞紐。七星級帆船飯店、世界最高的哈里發塔、人工島嶼，伴隨著許多創新的大型建築計畫，讓這個城市以不可思議的方式發展出沙漠中最奢華的綠洲奇蹟。,,多螢,http://mod.cht.com.tw/video/movie-details.php?id=460984,http://mod.cht.com.tw/img/iappic/460984.jpg,2017-10-06 21:58:03
紀實149,寵物ER第11集,2018-01-04,紀實149/寵物天地 紀實149/本週推薦 ,《寵物ER》透過不同寵物傷病診治的個案，帶出飼養寵物正確的知識和態度，更重要的是，還有治療過程當中的每個人，包括主人、獸醫、護士、家人…等等，希望通過展現他們的付出、抉擇和掙扎，讓無論有沒有飼養寵物的你，反思生命的價值。,,多螢,http://mod.cht.com.tw/video/movie-details.php?id=461002,http://mod.cht.com.tw/img/iappic/461002.jpg,2017-10-06 21:58:03
紀實149,夢想改造家第10集,2017-12-28,紀實149/美食生活 ,節目大膽突破了以色彩和擺飾為主的傳統裝修形式，聚焦在空間改變和功能實現上，由頂尖設計師在有限的資金，有限的空間裡根據委託人的特殊需求進行徹底的改造，通過聚焦全國範圍內不同地域特色的建築物，不同類型和背景的家庭故事，揭示家給予人的意義，見證家裝改造給予人的幸福。,"駱新,施琰",多螢,http://mod.cht.com.tw/video/movie-details.php?id=460074,http://mod.cht.com.tw/img/iappic/460074.jpg,2017-10-06 21:58:03
紀實149,拜託了冰箱(韓)第70集,2017-12-28,紀實149/美食生活 ,由來賓帶著家裡的冰箱一起到節目現場，利用冰箱裡的原材料來製作美食。讓兩位主廚在限時15分鐘內用來賓冰箱內的食材做出美食，四人一組，兩人對決，為每位來賓做兩道菜。,"金聖柱,安貞桓",多螢,http://mod.cht.com.tw/video/movie-details.php?id=460097,http://mod.cht.com.tw/img/iappic/460097.jpg,2017-10-06 21:58:03
紀實149,街舞狂潮,2017-12-07,紀實149/音樂藝術 ,第47屆金馬獎最佳紀錄片。臺灣第一部街舞文化紀錄片，拍攝舞者阿倫前往法國參加世界大賽，「要是這輩子沒來比過一次，心裡會留下遺憾」。,,多螢,http://mod.cht.com.tw/video/movie-details.php?id=455672,http://mod.cht.com.tw/img/iappic/455672.jpg,2017-10-06 21:58:03
紀實149,人類消失後的地球-文明地穴,2017-11-16,紀實149/科學探索 ,在世界末日後，人類文明的神秘的文物都放墓穴、保險箱以及時光膠囊裡。如今這些物件暴露在新的威脅之中。另外經過軍事訓練的狗是否能在野外生存？,,多螢,http://mod.cht.com.tw/video/movie-details.php?id=451953,http://mod.cht.com.tw/img/iappic/451953.jpg,2017-10-06 21:58:03
紀實149,提姆的動物狂想曲S1第6集,2017-12-21,紀實149/自然生態 ,本季，澳洲野生動物專家提姆為澳洲動物盡心盡力，從兇猛的鱷魚、帶劇毒的蜘蛛，到可愛的袋熊，以及眾人皆知最具澳洲代表性的無尾熊和袋鼠，也為拯救瀕臨絕種的袋獾進行袋獾方舟計畫。,提姆,多螢,http://mod.cht.com.tw/video/movie-details.php?id=459036,http://mod.cht.com.tw/img/iappic/459036.jpg,2017-10-06 21:58:03
紀實149,寵物ER第8集,2017-12-14,紀實149/寵物天地 ,《寵物ER》透過不同寵物傷病診治的個案，帶出飼養寵物正確的知識和態度，更重要的是，還有治療過程當中的每個人，包括主人、獸醫、護士、家人…等等，希望通過展現他們的付出、抉擇和掙扎，讓無論有沒有飼養寵物的你，反思生命的價值。,,多螢,http://mod.cht.com.tw/video/movie-details.php?id=458285,http://mod.cht.com.tw/img/iappic/458285.jpg,2017-10-06 21:58:03
紀實149,冰凍星球-地球盡頭,2017-11-02,紀實149/自然生態 ,【冰凍星球-地球盡頭】《冰凍星球》（英語：Frozen Planet）為英國廣播公司與探索頻道及英國公開大學聯合製作的自然紀錄片，由大衛‧愛登堡旁白，2011年10月26日起於英國廣播公司第一台及高清頻道首播，共6集，主要展示棲息於北極和南極的動植物及其生境，本集內容為其系列作第一集地球盡頭。,,,http://mod.cht.com.tw/video/movie-details.php?id=447997,http://mod.cht.com.tw/img/iappic/447997.jpg,2017-10-06 21:58:03
